A1: ProddProduct Descriptiton | B1: Fixture Color | C1: Switch-able | D1: Lamp Light Output (Lumens) | E1: Efficiency (Lumens per Watt) | F1: Watts | G1: Wattage Equivalent | H1: Dimensions | I1: Minimum Starting Temperature (degrees F) | J1: Light Source | K1: CRI | L1: Color Temperature (Kelvin, K) | M1: Life Expectancy (in hours) | N1: Recommended Applications | O1: Suitable Application | P1: ENERGY STAR Labelled | Q1: 1-5 Unit Price
A2: COMPACT FLUORESCENT LAMPS (CFLs)
A3: Screw-base CFLs
A4: Philips 15w R-30 Flood | C4: On/Off | D4: 600 | E4: =D4/F4 -> 40 | F4: 15 | G4: 40-60 | H4: 3.4" x 5.7" | I4: -10 | K4: 82 | L4: 2700 | M4: 8000 | N4: Protected Outdoor | Q4: 29
A5: Philips 20w R-30 Flood | C5: On/Off | D5: 675 | E5: =D5/F5 -> 33.75 | F5: 20 | G5: 60-75 | H5: 3.8" x 6.0" | I5: -10 | K5: 82 | L5: 2700 | M5: 8000 | N5: Protected Outdoor | Q5: 29
A6: Philips 15w R-40 Flood | C6: On/Off | D6: 675 | E6: =D6/F6 -> 45 | F6: 15 | G6: 40-60 | H6: 4.4" x 6.6" | I6: -10 | K6: 82 | L6: 2700 | M6: 8000 | N6: Protected Outdoor | Q6: 29
A7: Philips 20w R-40 Flood | C7: On/Off | D7: 875 | E7: =D7/F7 -> 43.75 | F7: 20 | G7: 60-75 | H7: 4.8" x 6.6" | I7: -10 | K7: 82 | L7: 2700 | M7: 8000 | N7: Protected Outdoor | Q7: 29
A8: Philips 15w Outdoor Capsule | C8: On/Off | D8: 800 | E8: =D8/F8 -> 53.333333333333336 | F8: 15 | G8: 40-60 | H8: 2.6" x 5.3" | I8: -10 | K8: 82 | L8: 2700 | M8: 10000 | N8: Protected Outdoor, Bare Socket, Pendant | O8: Recessed Downlights, Table Lamps | Q8: 15.7
A9: Philips 15w BugLite | C9: On/Off | D9: 800 | E9: =D9/F9 -> 53.333333333333336 | F9: 15 | G9: 40-60 | H9: 2.6" x 5.3" | I9: -10 | M9: 10000 | N9: Protected Outdoor | Q9: 19.6
A10: Osram Sylvania 15w Triple | C10: On/Off | D10: 925 | E10: =D10/F10 -> 61.666666666666664 | F10: 15 | G10: 40-60 | H10: 2.0" x 5.6" | I10: -22 | K10: 82 | L10: 3000 | M10: 10000 | N10: Ceiling Domes, Wall-Mounted, Pendant, Task Lamps | O10: Recessed Downlights, Indirect Lighting (Cove, Soffit, Valance), Table Lamps, Bare Socket, Protected Outdoor | P10: Yes | Q10: 12.5
A11: Osram Sylvania 20w Triple | C11: On/Off | D11: 1280 | E11: =D11/F11 -> 64 | F11: 20 | G11: 60-75 | H11: 2.0" x 6.3" | I11: -22 | K11: 82 | L11: 3000 | M11: 10000 | N11: Ceiling Domes, Wall-Mounted, Pendant, Table Lamps | O11: Recessed Downlights, Indirect Lighting (Cove, Soffit, Valance), Task Lamps, Bare Socket, Protected Outdoor | P11: Yes | Q11: 12.5
A12: Osram Sylvania 23w Triple | C12: On/Off | D12: 1580 | E12: =D12/F12 -> 68.695652173913047 | F12: 23 | G12: 60-75 | H12: 2.0" x 6.8" | I12: -22 | K12: 82 | L12: 3000 | M12: 10000 | N12: Ceiling Domes, Wall-Mounted, Pendant, Table Lamps | O12: Recessed Downlights, Indirect Lighting (Cove, Soffit, Valance), Bare Socket, Protected Outdoor, Torchiere with Screw-Base Socket | P12: Yes | Q12: 12.5
A13: Panasonic 15w Capsule (bullet/tube) | C13: On/Off | D13: 800 | E13: =D13/F13 -> 53.333333333333336 | F13: 15 | G13: 40-60 | H13: 2.3" x 5.3" | I13: 14 | K13: 84 | L13: 2800 | M13: 10000 | N13: Bare Socket, Pendant | O13: Recessed Downlights, Indirect Lighting (Cove, Soffit, Valance), Table Lamps, Bare Socket, Protected Outdoor | Q13: 14.1
A14: Panasonic 15w Capsule (globe) | C14: On/Off | D14: 800 | E14: =D14/F14 -> 53.333333333333336 | F14: 15 | G14: 40-60 | H14: 3.8" x 5.1" | I14: 14 | K14: 84 | L14: 2800 | M14: 10000 | N14: Bare Socket, Pendant | O14: Recessed Downlights, Wall-Mounted | Q14: 14.1
A15: Panasonic 25w Capsule (globe) | C15: On/Off | D15: 1370 | E15: =D15/F15 -> 54.8 | F15: 25 | G15: 75-100 | H15: 3.8" x 5.3" | I15: 14 | K15: 84 | L15: 2800 | M15: 10000 | N15: Bare Socket, Pendant | O15: Recessed Downlights, Wall-Mounted, Torchiere with Screw-Base Socket | Q15: 15.3
A16: Panasonic slim quad 11w | C16: On/Off | D16: 600 | E16: =D16/F16 -> 54.545454545454547 | F16: 11 | G16: 30-40 | H16: 1.5" x 5.4" | I16: -22 | K16: 84 | L16: 2700 | M16: 10000 | N16: Indirect Lighting (Cove, Soffit, Valance), Ceiling Domes, Wall-Mounted, Protected Outdoor, Table Lamps, Task Lamps | O16: Recessed Downlights, Table Lamps, Bare Socket, Protected Outdoor | Q16: 10.7
A17: Panasonic slim quad 15w | C17: On/Off | D17: 900 | E17: =D17/F17 -> 60 | F17: 15 | G17: 40-60 | H17: 1.5" x 6.0" | I17: -22 | K17: 84 | L17: 2700 | M17: 10000 | N17: Indirect Lighting (Cove, Soffit, Valance), Ceiling Domes, Wall-Mounted, Protected Outdoor, Table Lamps, Task Lamps | O17: Recessed Downlights, Table Lamps, Bare Socket, Protected Outdoor | Q17: 10.7
A18: Panasonic slim quad 20w | C18: On/Off | D18: 1200 | E18: =D18/F18 -> 60 | F18: 20 | G18: 60-75 | H18: 1.5" x 6.8" | I18: -22 | K18: 84 | L18: 2700 | M18: 10000 | N18: Indirect Lighting (Cove, Soffit, Valance), Ceiling Domes, Wall-Mounted, Protected Outdoor, | O18: Recessed Downlights, Task Lamps, Bare Socket, Protected Outdoor | Q18: 10.7
A19: Philips R-30 15w Reflector | C19: On/Off | D19: 600 | E19: =D19/F19 -> 40 | F19: 15 | G19: 40-60 | H19: 3.8" x 6.0" | I19: -10 | K19: 82 | L19: 2700 | M19: 8000 | N19: Recessed Downlights, Protected Outdoor | Q19: 29
A20: Philips R-30 20w Reflector | C20: On/Off | D20: 675 | E20: =D20/F20 -> 33.75 | F20: 20 | G20: 60-75 | H20: 3.8" x 6.0" | I20: -10 | K20: 82 | L20: 2700 | M20: 8000 | N20: Recessed Downlights, Protected Outdoor | Q20: 29
A21: Lights of America 15w spiral design | C21: On/Off | D21: 950 | E21: =D21/F21 -> 63.333333333333336 | F21: 15 | G21: 40-60 | H21: 2.4" x 5.3" | I21: -10 | K21: 84 | L21: 2800 | M21: 10000 | N21: Ceiling Domes, Wall-Mounted, Pendant, Task Lamps, Protected Outdoor | O21: Recessed Downlighting, Indirect Lighting, Bare Socket, Table Lamps | Q21: 12.2
A22: Lights of America 20w spiral design | C22: On/Off | D22: 1200 | E22: =D22/F22 -> 60 | F22: 20 | G22: 60-75 | H22: 2.4" x 5.3" | I22: -10 | K22: 84 | L22: 2800 | M22: 10000 | N22: Wall-Mounted, Pendant, Protected Outdoor | O22: Recessed Downlighting, Indirect Lighting, Bare Socket, Task Lamps | Q22: 12.2
A23: Maxlite Circular 20w | C23: On/Off | D23: 1300 | E23: =D23/F23 -> 65 | F23: 20 | G23: 60-75 | H23: 3.9" x 8.0" | I23: 14 | K23: 84 | L23: 2800 | M23: 10000 | N23: Pendant, Table Lamps, | Q23: 14.1
A24: Maxlite Circular 30w | C24: On/Off | D24: 2000 | E24: =D24/F24 -> 66.666666666666671 | F24: 30 | G24: 75-100+ | H24: 3.9" x 9.3" | I24: 14 | K24: 84 | L24: 2800 | M24: 10000 | N24: Pendant, Table Lamps, | O24: Bare Socket | Q24: 14.1
A25: GE 38w 2D 3-Way | C25: 2-way | D25: 2780 | E25: =D25/F25 -> 73.15789473684211 | F25: 38 | G25: 120-150+ | H25: 8" x 4.5" | I25: 0 | K25: 84 | L25: 2700 | M25: 10,000 40,000 ballast | N25: Pendant, Table Lamps, | O25: Bare Socket | Q25: 24.3
A26: Lights of America 3-Way (34w) | C26: On/Off | D26: 800/1,600/2,400 | E26: =2400/F26 -> 70.588235294117652 | F26: 34 | G26: 120-150 | H26: 8.6" x 3.4" | I26: 0 | K26: 84 | L26: 2800 | M26: 12,000 75,000 ballast | N26: Pendant, Table Lamps, | O26: Bare Socket | Q26: 18.8
A27: GE triples 15w | C27: On/Off | D27: 900 | E27: =D27/F27 -> 60 | F27: 15 | G27: 40-60 | H27: 1.9" x 5.2" | I27: -10 | K27: 82 | L27: 2700 | M27: 10000 | N27: Ceiling Domes, Wall-Mounted, Pendant, Task Lamps | O27: Recessed Downlights, Indirect Lighting (Cove, Soffit, Valance), Table Lamps, Bare Socket, Protected Outdoor | Q27: 14
A28: GE triples 20w | C28: On/Off | D28: 1200 | E28: =D28/F28 -> 60 | F28: 20 | G28: 60-75 | H28: 1.9" x 6.6" | I28: -10 | K28: 82 | L28: 2700 | M28: 10000 | N28: Ceiling Domes, Wall-Mounted, Pendant, Table Lamps | O28: Recessed Downlights, Indirect Lighting (Cove, Soffit, Valance), Task Lamps, Bare Socket, Protected Outdoor | Q28: 14
A29: GE triples 24w | C29: On/Off | D29: 1520 | E29: =D29/F29 -> 63.333333333333336 | F29: 24 | G29: 75-100 | H29: 2.3" x 6.9" | I29: -10 | K29: 82 | L29: 2700 | M29: 10000 | N29: Ceiling Domes, Wall-Mounted, Pendant, Table Lamps | O29: Recessed Downlights, Indirect Lighting (Cove, Soffit, Valance), Bare Socket, Protected Outdoor | Q29: 14
A30: Philips SLS triple 15w | C30: On/Off | D30: 900 | E30: =D30/F30 -> 60 | F30: 15 | G30: 40-60 | H30: 2.3" x 5.3" | I30: 32 | K30: 82 | L30: 2700 | M30: 10000 | N30: Ceiling Domes, Wall-Mounted, Pendant, Task Lamps | O30: Recessed Downlights, Indirect Lighting (Cove, Soffit, Valance), Table Lamps, Bare Socket, Protected Outdoor | Q30: 15.9
A31: Philips SLS triple 20w | C31: On/Off | D31: 1200 | E31: =D31/F31 -> 60 | F31: 20 | G31: 60-75 | H31: 2.3" x 5.6" | I31: 32 | K31: 82 | L31: 2700 | M31: 10000 | N31: Ceiling Domes, Wall-Mounted, Pendant, Table Lamps | O31: Recessed Downlights, Indirect Lighting (Cove, Soffit, Valance), Task Lamps, Bare Socket, Protected Outdoor | Q31: 15.9
A32: Philips SLS triple 23w | C32: On/Off | D32: 1550 | E32: =D32/F32 -> 67.391304347826093 | F32: 23 | G32: 75-100 | H32: 2.3" x 6.2" | I32: 32 | K32: 82 | L32: 2700 | M32: 10000 | N32: Ceiling Domes, Wall-Mounted, Pendant, Table Lamps | O32: Recessed Downlights, Indirect Lighting (Cove, Soffit, Valance), Bare Socket, Protected Outdoor | Q32: 15.9
A33: TCP spiral design 15w | C33: On/Off | D33: 980 | E33: =D33/F33 -> 65.333333333333329 | F33: 15 | G33: 40-60 | H33: 2.1" W x 5.5" L | I33: -20 | K33: 84 | L33: 2700 | M33: 10000 | N33: Ceiling Domes, Wall-Mounted, Pendant, Task Lamps | O33: Recessed Downlights, Indirect Lighting (Cove, Soffit, Valance), Table Lamps, Bare Socket, Protected Outdoor | Q33: 12.5
A34: TCP spiral design 18w | C34: On/Off | D34: 1200 | E34: =D34/F34 -> 66.666666666666671 | F34: 18 | G34: 60-75 | H34: 2.1" W x 5.5" | I34: -20 | K34: 84 | L34: 2700 | M34: 10000 | N34: Ceiling Domes, Wall-Mounted, Pendant, Table Lamps | O34: Recessed Downlights, Indirect Lighting (Cove, Soffit, Valance), Task Lamps, Bare Socket, Protected Outdoor | Q34: 12.5
A35: TCP spiral design 23w | C35: On/Off | D35: 1500 | E35: =D35/F35 -> 65.217391304347828 | F35: 23 | G35: 75-100 | H35: 2.1" W x 5.8" L | I35: -20 | K35: 84 | L35: 2700 | M35: 10000 | N35: Ceiling Domes, Wall-Mounted, Pendant, Table Lamps | O35: Recessed Downlights, Indirect Lighting (Cove, Soffit, Valance), Bare Socket, Protected Outdoor | Q35: 12.5
A36: GFL 15w Spiral Whirlux | C36: On/Off | D36: 982 | E36: =D36/F36 -> 65.466666666666669 | F36: 15 | G36: 40-60 | H36: 2.0" W x 5.0" L | I36: -18 | K36: 82 | L36: 2700 | M36: 10000 | N36: Ceiling Domes, Wall-Mounted, Pendant, Task Lamps | O36: Recessed Downlights, Indirect Lighting (Cove, Soffit, Valance), Table Lamps, Bare Socket, Protected Outdoor
A37: GFL 20w Spiral Whirlux | C37: On/Off | D37: 1209 | E37: =D37/F37 -> 60.45 | F37: 20 | G37: 60-75 | H37: 2.0" W x 5.25" L | I37: -18 | K37: 82 | L37: 2700 | M37: 10000 | N37: Ceiling Domes, Wall-Mounted, Pendant, Table Lamps | O37: Recessed Downlights, Indirect Lighting (Cove, Soffit, Valance), Task Lamps, Bare Socket, Protected Outdoor
A38: GFL 23w Spiral Whirlux | C38: On/Off | D38: 1350 | E38: =D38/F38 -> 58.695652173913047 | F38: 23 | G38: 75-100 | H38: 2.0" W x 6.5" l | I38: -18 | K38: 82 | L38: 2700 | M38: 10000 | N38: Ceiling Domes, Wall-Mounted, Pendant, Table Lamps | O38: Recessed Downlights, Indirect Lighting (Cove, Soffit, Valance), Bare Socket, Protected Outdoor
A39: Maxlite 11w "minimax" loop | C39: On/Off | D39: 600 | E39: =D39/F39 -> 54.545454545454547 | F39: 11 | G39: 40 | H39: 2.0" W x 5.3" H | I39: -10 | K39: 82 | L39: 2700 | M39: 10000 | N39: Ceiling Domes, Wall-Mounted, Pendant, Table Lamps | O39: Recessed Downlights, Indirect Lighting (Cove, Soffit, Valance), Bare Socket, Protected Outdoor | Q39: 11.4
A40: Maxlite 15w "minimax" loop | C40: On/Off | D40: 900 | E40: =D40/F40 -> 60 | F40: 15 | G40: 40-60 | H40: 2.0" W x 5.8" H | I40: -10 | K40: 82 | L40: 2700 | M40: 10000 | N40: Ceiling Domes, Wall-Mounted, Pendant, Table Lamps | O40: Recessed Downlights, Indirect Lighting (Cove, Soffit, Valance), Bare Socket, Protected Outdoor | Q40: 11.4
A42: REPLACEMENT CFLs
A43: Panasonic 13w Quick Start Quad | C43: On/Off | D43: 860 | E43: =D43/F43 -> 66.15384615384616 | F43: 13 | G43: 40-60 | H43: NA | I43: NA | K43: 84 | L43: 2700 | M43: 10000 | N43: See various fixtures | O43: See various fixtures | Q43: 4.7
A44: LOA 13w Quad | C44: On/Off | D44: 900 | E44: =D44/F44 -> 69.230769230769226 | F44: 13 | G44: 40-60 | H44: NA | I44: NA | K44: 84 | L44: 2800 | M44: 10000 | N44: See various fixtures | O44: See various fixtures | Q44: 7.1
A45: LOA 20w Circular | C45: On/Off | D45: 1400 | E45: =D45/F45 -> 70 | F45: 20 | G45: 60-75 | H45: NA | I45: NA | K45: 84 | L45: 2800 | M45: 12000 | N45: See various fixtures | O45: See various fixtures | Q45: 7
A46: Osram Sylvania 36w Linear Quad | C46: On/Off | D46: 2800 | E46: =D46/F46 -> 77.777777777777771 | F46: 36 | G46: 120-150 | H46: NA | I46: NA | K46: 82 | L46: 3000 | M46: 10000 | N46: See various fixtures | O46: See various fixtures | Q46: 15.6
A47: 26w 4-pin Quad | C47: On/Off | D47: 1800 | E47: =D47/F47 -> 69.230769230769226 | F47: 26 | G47: 75-100 | H47: NA | I47: NA | K47: 82 | L47: 3000 | M47: 10000 | N47: See various fixtures | O47: See various fixtures | Q47: 8.9
A48: LOA 27w Quad | C48: On/Off | D48: 1800 | E48: =D48/F48 -> 66.666666666666671 | F48: 27 | G48: 75-100 | H48: NA | I48: NA | K48: 82 | L48: 2800 | M48: 10000 | N48: See various fixtures | O48: See various fixtures | Q48: 7
A49: LOA 27w Flat Quad | C49: On/Off | D49: 1800 | E49: =D49/F49 -> 66.666666666666671 | F49: 27 | G49: 75-100 | H49: NA | I49: NA | K49: 84 | L49: 4000 | M49: 10000 | N49: See various fixtures | O49: See various fixtures | Q49: 8.6
A50: LOA 30w Circular | C50: On/Off | D50: 2400 | E50: =D50/F50 -> 80 | F50: 30 | G50: 100-150 | H50: NA | I50: NA | K50: 84 | L50: 2800 | M50: 12000 | N50: See various fixtures | O50: See various fixtures | Q50: 7.5
A51: Maxlite 30w Circular | C51: On/Off | D51: 1850 | E51: =D51/F51 -> 61.666666666666664 | F51: 30 | G51: 100-150 | H51: NA | I51: NA | K51: 84 | L51: 2800 | M51: 10000 | N51: See various fixtures | O51: See various fixtures | Q51: 8.5
A52: Philips F25T8/TL741 tube | C52: On/Off | D52: 1925 | E52: =D52/F52 -> 77 | F52: 25 | G52: 75-100 | H52: NA | I52: NA | K52: 75 | L52: 4100 | M52: 20000 | N52: See various fixtures | O52: See various fixtures | Q52: 3.4
A53: GE 55w 2-D | C53: Dim | D53: 3900 | E53: =D53/F53 -> 70.909090909090907 | F53: 55 | G53: 200-250 | H53: NA | I53: NA | K53: 82 | L53: 3000 | M53: 10000 | N53: See various fixtures | O53: See various fixtures | Q53: 13.6
A55: FIXTURES
A56: Interior Fixtures
A57: Brownlee WallaceCeiling Dome 26w | B57: Brass/Frosted white | C57: On/Off | D57: 1700 | E57: =D57/F57 -> 65.384615384615387 | F57: 26 | G57: 75-100 | H57: 15" Diameter, 9.5" Depth | J57: 26 w quad | K57: 84 | L57: 2700 | M57: 10000 | P57: Yes | Q57: 66.3
A58: Brownlee Andrew Ceiling Dome 26w | B58: Brass/Glass | C58: On/Off | D58: 1700 | E58: =D58/F58 -> 65.384615384615387 | F58: 26 | G58: 75-100 | H58: 15" Diameter, 9.5" Depth | J58: 26 w quad | K58: 84 | L58: 2700 | M58: 10000 | P58: Yes | Q58: 58.9
A59: Brownlee Whitney Ceiling Dome 26w | B59: Brass/Glass | C59: On/Off | D59: 1700 | E59: =D59/F59 -> 65.384615384615387 | F59: 26 | G59: 75-100 | H59: 15" Diameter, 9.5" Depth | J59: 26 w quad | K59: 84 | L59: 2700 | M59: 10000 | P59: Yes | Q59: 49.5
A60: Good Earth Sparta C Dome 30w | B60: Brass/Glass | C60: On/Off | D60: 1800 | E60: =D60/F60 -> 60 | F60: 30 | G60: 75-100+ | H60: 14.5" Diameter 3.5" Depth | J60: 30 w circular | K60: 84 | L60: 2700 | M60: 10000 | P60: Yes | Q60: 39.2
A61: Good Earth Terrazo C Dome 30w | B61: White/Glass | C61: On/Off | D61: 1800 | E61: =D61/F61 -> 60 | F61: 30 | G61: 75-100+ | H61: 14.5" Diameter 3.5" Depth | J61: 30 w circular | K61: 84 | L61: 2700 | M61: 10000 | P61: Yes
A62: Good Earth Dubois C Dome 30w | B62: White/Glass | C62: On/Off | D62: 1800 | E62: =D62/F62 -> 60 | F62: 30 | G62: 75-100+ | H62: 15" Diameter 4" Depth | J62: 30 w circular | K62: 84 | L62: 2700 | M62: 10000 | P62: Yes | Q62: 37.6
A63: Good Earth LaScala C Dome 30w | B63: Nickel/Glass | C63: On/Off | D63: 1800 | E63: =D63/F63 -> 60 | F63: 30 | G63: 75-100+ | H63: 14.5" Diameter 3.5" Depth | J63: 30 w circular | K63: 84 | L63: 2700 | M63: 10000 | P63: Yes
A64: LOA Simplicity 30w Ceiling Dome | B64: White/Frosted White | C64: On/Off | D64: 2400 | E64: =D64/F64 -> 80 | F64: 30 | G64: 75-100+ | H64: 14" Diameter, 4.6" | J64: 30 w circular | K64: 84 | L64: 2800 | M64: 12,000 75,000 ballast | P64: Yes | Q64: 37.6
A65: LOA Elegance 30w Ceiling Dome | B65: Brass/Frosted Acryllic | C65: On/Off | D65: 2400 | E65: =D65/F65 -> 80 | F65: 30 | G65: 75-100+ | H65: 14" Diameter, 4.6" | J65: 30 w circular | K65: 84 | L65: 2800 | M65: 12,000 75,000 ballast | P65: Yes | Q65: 37.6
A66: LOA Sophistication 30w Ceil. Dome | B66: Brass/Frosted White | C66: On/Off | D66: 2400 | E66: =D66/F66 -> 80 | F66: 30 | G66: 75-100+ | H66: 14" Diameter, 4.6" | J66: 30 w circular | K66: 84 | L66: 2800 | M66: 12,000 75,000 ballast | P66: Yes | Q66: 37.6
A67: LOA Grandeur 30w Ceiling Dome | B67: Brass/Frosted White | C67: On/Off | D67: 2400 | E67: =D67/F67 -> 80 | F67: 30 | G67: 75-100+ | H67: 14" Diameter, 4.6" | J67: 30 w circular | K67: 84 | L67: 2800 | M67: 12,000 75,000 ballast | P67: Yes | Q67: 37.6
A68: Westerfield Low-Profile Ceiling Drum 26w | B68: White | C68: On/Off | D68: 1700 | E68: =D68/F68 -> 65.384615384615387 | F68: 26 | G68: 75-100 | H68: 11.8" Diameter, 2.8" Depth | J68: 26 w quad | K68: 84 | L68: 2800 | M68: 10000 | P68: Yes | Q68: 43.8
A69: Westerfield Brass close-to-ceiling Fixture 26w | B69: Brass/Acrylic | C69: On/Off | D69: 1700 | E69: =D69/F69 -> 65.384615384615387 | F69: 26 | G69: 100 | H69: 14" Diameter, 8" Depth | J69: 26 w quad | K69: 84 | L69: 2800 | M69: 10000 | P69: Yes | Q69: 63.4
A70: Brownlee Cloud Bath Vanity 50w | B70: Steel/Acrylic | C70: On/Off | D70: 4000 | E70: =D70/F70 -> 80 | F70: 50 | G70: 200 | H70: 39" Length, 6" Height, 4.3" Depth | J70: two 25w T8 tubes | K70: 82 | L70: 3000 | M70: 10000 | P70: Yes | Q70: 69.4
A71: Brownlee Pearl Bath Vanity 50w | B71: Steel/Acrylic | C71: On/Off | D71: 4000 | E71: =D71/F71 -> 80 | F71: 50 | G71: 200 | H71: 37" Length, 6" Height, 4.3" Depth | J71: two 25w T8 tubes | K71: 82 | L71: 3000 | M71: 10000 | P71: Yes | Q71: 64.1
A72: Exterior Fixtures
A73: LOA Decorative Wall Lantern 13w black ("Concord") | B73: black | C73: On/Off | D73: 900 | E73: =D73/F73 -> 69.230769230769226 | F73: 13 | G73: 60 | H73: 8" W x 12.2" H x 6.5" D | I73: 0 | J73: 13w quad | K73: 84 | L73: 2800 | M73: 12000 | P73: Yes | Q73: 39.9
A74: LOA Decorative Wall Lantern 13w white ("Concord") | B74: white | C74: On/Off | D74: 900 | E74: =D74/F74 -> 69.230769230769226 | F74: 13 | G74: 60 | H74: 8" W x 12.2" H x 6.5" D | I74: 0 | J74: 13w quad | K74: 84 | L74: 2800 | M74: 12000 | P74: Yes | Q74: 39.9
A75: LOA Decorative Wall Lantern 27w black ("Lexington") | B75: black | C75: On/Off | D75: 1650 | E75: =D75/F75 -> 61.111111111111114 | F75: 27 | G75: 100 | H75: 9.9" W x 17.3" H x 8.9" D | I75: 0 | J75: 27w quad | K75: 84 | L75: 2800 | M75: 12000 | P75: Yes | Q75: 47
A76: LOA Decorative Lantern 27w white ("Lexington") | B76: white | C76: On/Off | D76: 1650 | E76: =D76/F76 -> 61.111111111111114 | F76: 27 | G76: 75-100 | H76: 9.9" W x 17.3" H x 8.9" D | I76: 0 | J76: 27w quad | K76: 84 | L76: 2800 | M76: 12000 | P76: Yes | Q76: 47
A77: Westerfield Classic Brass Coach Lantern 13w | B77: brass | C77: On/Off | D77: 860 | E77: =D77/F77 -> 66.15384615384616 | F77: 13 | G77: 40-60 | H77: 6.5" W x 10.5" H x 7" D | I77: 0 | J77: 13w quad | K77: 84 | L77: 2700 | M77: 10000 | Q77: 75.9
A78: Westerfield Classic Brass Wall Torch Lantern 13w | B78: brass | C78: On/Off | D78: 860 | E78: =D78/F78 -> 66.15384615384616 | F78: 13 | G78: 40-60 | H78: 4.8" W x 14" H x 5.5" D | I78: 0 | J78: 13w quad | K78: 84 | L78: 2700 | M78: 10000 | Q78: 60.2
A79: LOA Exterior Floodlight 27w | B79: Black | C79: On/Off | D79: 860 | E79: =D79/F79 -> 31.851851851851851 | F79: 27 | G79: 75-100 | H79: 9.3" W x 4.5" H x 7.5" D | I79: -12 | J79: 13w quad | K79: 84 | L79: 4100 | M79: 12000 | P79: Yes | Q79: 34.5
A80: LOA Panorama Security 27w | B80: Black | C80: On/Off | D80: 900 | E80: =D80/F80 -> 33.333333333333336 | F80: 27 | G80: 75-100 | H80: 7.5" W x 10" H x 4.3" D | I80: -20 | J80: 13w quad | K80: 84 | L80: 4000 | M80: 10000 | P80: Yes | Q80: 34.5
A81: Torchiere Floor Lamps
A82: EFI Continental CF Torchiere 52w white | B82: white | C82: 2-Way | D82: 3600 | E82: =D82/F82 -> 69.230769230769226 | F82: 52 | G82: 200 | H82: h: 71", bd: 11" | I82: NA | J82: 26w quad (two) | K82: 82 | L82: 3000 | M82: 10000 | P82: Yes | Q82: 54.6
A83: EFI Continental CF Torchiere 52w black | B83: black | C83: 2-Way | D83: 3600 | E83: =D83/F83 -> 69.230769230769226 | F83: 52 | G83: 200 | H83: h: 71", bd: 11" | I83: NA | J83: 26w quad (two) | K83: 82 | L83: 3000 | M83: 10000 | P83: Yes | Q83: 54.6
A84: LOA Grand Liberty CF Torchiere 55w wh | B84: white | C84: 3-Way | D84: 4050 | E84: =D84/F84 -> 73.63636363636364 | F84: 55 | G84: 200+ | H84: h: 70", bd: 16" | I84: NA | J84: 20w and 30w circlines | K84: 84 | L84: 2700 | M84: 10000 | P84: Yes | Q84: 44.9
A85: LOA Grand Liberty CF Torchiere 55w blk | B85: black | C85: 3-Way | D85: 4050 | E85: =D85/F85 -> 73.63636363636364 | F85: 55 | G85: 200+ | H85: h: 70", bd: 16" | I85: NA | J85: 20w and 30w circlines | K85: 84 | L85: 2700 | M85: 10000 | P85: Yes | Q85: 44.9
A86: Good Earth Lincoln Park 55w blk | B86: black | C86: Dim | D86: 4200 | E86: =D86/F86 -> 76.36363636363636 | F86: 55 | G86: 200-250 | H86: h: 70.75", bd: 165" | I86: NA | J86: 55w 2D | K86: 82 | L86: 3000 | M86: 10000 | P86: Yes | Q86: 58.9
A87: Good Earth Lincoln Park 55w wh | B87: white | C87: Dim | D87: 4200 | E87: =D87/F87 -> 76.36363636363636 | F87: 55 | G87: 200-250 | H87: h: 70.75", bd: 165" | I87: NA | J87: 55w 2D | K87: 82 | L87: 3000 | M87: 10000 | P87: Yes | Q87: 58.9
A88: Good Earth Glencoe 55w br/nickel | B88: br/nickel | C88: Dim | D88: 4200 | E88: =D88/F88 -> 76.36363636363636 | F88: 55 | G88: 200-250 | H88: h: 70.75", bd: 165" | I88: NA | J88: 55w 2D | K88: 82 | L88: 3000 | M88: 10000 | P88: Yes | Q88: 73.6
A89: Good Earth Glencoe 55w br/brass | B89: br/brass | C89: Dim | D89: 4200 | E89: =D89/F89 -> 76.36363636363636 | F89: 55 | G89: 200-250 | H89: h: 70.75", bd: 165" | I89: NA | J89: 55w 2D | K89: 82 | L89: 3000 | M89: 10000 | P89: Yes | Q89: 73.6
A90: Good Earth Lake Forest green | B90: green | C90: Dim | D90: 4200 | E90: =D90/F90 -> 76.36363636363636 | F90: 55 | G90: 200-250 | H90: h: 70.75", bd: 165" | I90: NA | J90: 55w 2D | K90: 82 | L90: 3000 | M90: 10000 | P90: Yes | Q90: 69.2
A91: Good Earth Lake Forest burgundy | B91: burgundy | C91: Dim | D91: 4200 | E91: =D91/F91 -> 76.36363636363636 | F91: 55 | G91: 200-250 | H91: h: 70.75", bd: 165" | I91: NA | J91: 55w 2D | K91: 82 | L91: 3000 | M91: 10000 | P91: Yes | Q91: 69.2
A92: EFI Filigree CF Torchiere 52w black | B92: black | C92: 2-Way | D92: 3600 | E92: =D93/F93 -> 69.230769230769226 | F92: 52 | G92: 200 | H92: h: 71", bd: 11", pd: 1" | I92: NA | J92: 26w quad (two) | K92: 82 | L92: 3000 | M92: 10000 | P92: Yes | Q92: 54.6
A93: EFI Atlas 3-Way CF Torchiere 78w black | B93: black | C93: 3-Way | D93: 5400 | E93: =D94/F94 -> 69.230769230769226 | F93: 78 | G93: 300 | H93: h: 71", bd: 14.5", pd: 1" | I93: NA | J93: 26w quad (three) | K93: 82 | L93: 3000 | M93: 10000 | P93: Yes | Q93: 76.2
A94: EFI Atlas 3-Way CF Torchiere 78w white | B94: white | C94: 3-Way | D94: 5400 | E94: =D95/F95 -> 69.230769230769226 | F94: 78 | G94: 300 | H94: h: 71", bd: 14.5", pd: 1" | I94: NA | J94: 26w quad (three) | K94: 82 | L94: 3000 | M94: 10000 | P94: Yes | Q94: 76.2
A95: Desk Lamps
A96: Adesso Scottsdale Banker's Lamp - Steel and Natural Wood | B96: Steel/Pine | C96: On/Off | D96: 1800 | E96: =D97/F97 -> 66.666666666666671 | F96: 27 | G96: 100 | H96: 15" height, 10" wide base, 6.25" deep | I96: NA | J96: 27w quad | K96: NA | L96: NA | M96: 10000 | Q96: 74.4
A98: ACCESSORIES
A99: Plug-It Utility Light | B99: yellow housing | C99: On/Off | D99: 900 | E99: =D100/F100 -> 69.230769230769226 | F99: 13 | G99: 40-60 | H99: 2.2" wide, 13.75" long | I99: NA | J99: 13 w quad | K99: 82 | L99: 2700 | M99: 10000 | N99: car repair, small spaces where portable task lamp is desired | O99: car repair, small spaces where portable task lamp is desired | Q99: 24.4
A100: Mytec Motion Sensing Wall Switch (White) | B100: White | N100: Home or Office (see product description) | O100: Home or Office (see product description) | Q100: 49.4
A101: Mytec Motion Sensing Wall Switch (Ivory) | B101: Ivory | N101: Home or Office (see product description) | O101: Home or Office (see product description) | Q101: 49.4
A102: INTERMATIC LAMP TIMER | B102: steel | N102: Home or Office (see product description) | O102: Home or Office (see product description) | Q102: 9.3
A103: INTERMATIC HEAVY DUTY LAMP TIMER | B103: steel | N103: Home or Office (see product description) | O103: Home or Office (see product description) | Q103: 14.1
A104: LimeLite Night Light | B104: Lime light glow | C104: On/Off | D104: N/A | F104: 00.03 | M104: Lifetime | N104: Home (hallway, bedroom, bathroom) | O104: Home (hallway, bedroom, bathroom) | Q104: 2.7
A105: BOOKS AND INFORMATIONAL PRODUCTS
A106: E Source Lighting Technology Atlas
A107: E Source Power Tools
A108: ESPIO Directory
A109: ESPIO Website
A110: ESPIO Combination Print and Internet Subscription
A111: Lighting Pattern Book for Homes
A112: The Outdoor Lighting Pattern Book
A113: Builder's Guide to Home Lighting
A114: The Case for Energy-Efficient Lighting
A115: BARGAIN BASEMENT
A116: Emess Coolbrite 4000 | B116: black | C116: 2-Way | D116: 4200 | E116: =D117/F117 -> 58.333333333333336 | F116: 72 | G116: 250 | H116: h: 70.75", bd: 165" | I116: NA | J116: 36w linear quad (two) | K116: 82 | L116: 3000 | M116: 10000 | P116: Yes | Q116: 79.95